{
  "schemaVersion": 1,
  "specificationVersion": "0.1.0",
  "lifecycle": "ReviewReady",
  "identity": {
    "componentKey": "02:data-grid",
    "legacyId": "data-grid",
    "name": "数据表格",
    "englishName": "Data Grid",
    "category": "02",
    "exportName": "DataGrid",
    "packageSubpath": "@company/ui/data-grid"
  },
  "purpose": {
    "job": "以稳定行身份展示和操作二维业务数据，并在排序、筛选、选择和异步刷新时保持状态一致。",
    "success": "用户可定位行列、排序、筛选和选择；任何数据变化都不造成选择错位或编辑静默丢失。"
  },
  "boundaries": {
    "inScope": ["展示", "排序", "筛选", "选择", "分页/虚拟窗口", "加载/空/错误"],
    "outOfScope": ["单元格编辑事务", "公式计算", "透视聚合", "服务端查询实现"]
  },
  "dataContract": {
    "row": "泛型 TRow；必须由 getRowId(row) 返回稳定 string。",
    "column": "{ id; header; accessor; cell; sortable?; width?; minWidth?; maxWidth? }",
    "selection": "ReadonlySet<RowId>，按行 ID 而非索引。",
    "query": "{ sorting; filters; page | virtualRange }，服务端模式通过事件交给消费方。"
  },
  "publicApi": {
    "status": "proposed",
    "props": [
      { "name": "rows", "type": "readonly TRow[]", "required": true },
      { "name": "columns", "type": "readonly DataGridColumn<TRow>[]", "required": true },
      { "name": "getRowId", "type": "(row: TRow) => string", "required": true },
      { "name": "sorting", "type": "readonly SortRule[]", "required": false },
      { "name": "filters", "type": "readonly FilterRule[]", "required": false },
      { "name": "selection", "type": "ReadonlySet<string>", "required": false },
      { "name": "loading", "type": "boolean", "required": false, "default": false },
      { "name": "error", "type": "DataGridError | null", "required": false, "default": null },
      { "name": "mode", "type": "client | server | virtual", "required": false, "default": "client" }
    ],
    "events": [
      { "name": "onSortingChange", "payload": "readonly SortRule[]" },
      { "name": "onFiltersChange", "payload": "readonly FilterRule[]" },
      { "name": "onSelectionChange", "payload": "ReadonlySet<RowId>" },
      { "name": "onRetry", "payload": "{ querySnapshot: DataGridQuery }" }
    ],
    "refMethods": ["focusCell(rowId, columnId): void", "scrollToRow(rowId): void"],
    "controlledState": {
      "rule": "提供值 prop 时由消费方控制；未提供时使用 default*；运行期不允许在受控与非受控间切换。"
    }
  },
  "stateMachine": {
    "states": ["idle", "loadingInitial", "ready", "empty", "refreshing", "errorInitial", "errorRefresh"],
    "initialState": "loading ? loadingInitial : rows.length ? ready : empty",
    "transitions": [
      { "from": "ready|empty", "event": "QUERY_CHANGE", "to": "refreshing" },
      { "from": "refreshing", "event": "RESOLVE_NONEMPTY", "to": "ready" },
      { "from": "refreshing", "event": "RESOLVE_EMPTY", "to": "empty" },
      { "from": "refreshing", "event": "REJECT", "to": "errorRefresh" },
      { "from": "errorInitial|errorRefresh", "event": "RETRY", "to": "loadingInitial|refreshing" }
    ]
  },
  "primaryFlow": {
    "id": "sort-filter-select",
    "steps": [
      {
        "actor": "仓库主管",
        "precondition": "rows 含 rowId LOT-01/LOT-02/LOT-03；金额列可排序。",
        "control": "金额列表头排序按钮",
        "action": "按 Enter 将金额按降序排序。",
        "stateTransition": "ready -> refreshing -> ready（server）或 ready -> ready（client）。",
        "observable": "onSortingChange([{id:'amount',desc:true}]) 触发一次；活动表头 aria-sort=descending。",
        "oracle": "排序后每行仍通过 getRowId 关联原业务对象，选择集不按索引漂移。"
      },
      {
        "actor": "仓库主管",
        "precondition": "排序完成且 LOT-02 位于新位置。",
        "control": "LOT-02 行选择框",
        "action": "按 Space 选择 LOT-02。",
        "stateTransition": "selection {} -> {LOT-02}。",
        "observable": "onSelectionChange(new Set(['LOT-02'])) 触发一次；该行 aria-selected=true。",
        "oracle": "再次排序或刷新同一 rowId 后，LOT-02 仍保持选中；不存在重复 ID 时才允许提交状态。"
      }
    ]
  },
  "exceptionFlows": [
    {
      "id": "refresh-failed",
      "trigger": "已有 rows 时，排序请求返回 NETWORK_ERROR。",
      "blockedEffect": "不得清空旧 rows、选择集、查询条件或活动单元格。",
      "retainedState": "旧 rows 与选择集保留，状态进入 errorRefresh。",
      "recovery": "用户激活“重试”，组件以同一 querySnapshot 发出 onRetry。",
      "focusResult": "焦点留在错误区域的重试按钮；成功后返回原活动表头。",
      "oracle": "失败期间旧数据可读但明确标记可能过期；重试不重复追加行。"
    },
    {
      "id": "duplicate-row-id",
      "trigger": "getRowId 对两行返回相同 ID。",
      "blockedEffect": "不得启用选择、行级操作或将错误行静默合并。",
      "retainedState": "查询和列配置保留。",
      "recovery": "消费方修正 rows/getRowId 后重新渲染。",
      "focusResult": "焦点进入表格级错误摘要。",
      "oracle": "开发与测试环境抛出明确契约错误；生产环境显示不可操作错误态并记录观测事件。"
    }
  ],
  "keyboardAndFocus": {
    "model": "ARIA Grid，单一活动单元格使用 roving tabindex。",
    "pattern": "ARIA Grid；单一 roving tabindex 活动单元格。",
    "keys": "方向键移动；Home/End 行内边界；Ctrl+Home/End 表格边界；Space 选择行；Enter 激活单元格主操作。",
    "focusRecovery": "刷新失败后焦点进入重试按钮；成功后返回原活动表头或单元格。",
    "virtualization": "活动行移出窗口时 aria-activedescendant 不指向不存在节点；滚动完成后恢复。"
  },
  "accessibility": {
    "semantics": "grid/row/columnheader/gridcell；aria-rowcount/colcount 反映逻辑规模。",
    "roles": "grid/row/columnheader/gridcell；aria-rowcount/colcount 反映逻辑规模。",
    "announcements": "排序、筛选结果数和加载失败用 polite live region；不逐行播报刷新。"
  },
  "visualAndResponsive": {
    "desktop": "列宽遵守 min/max；横向滚动时表头与单元格对齐。",
    "mobile": "390px 保留横向滚动，不把二维关系改成语义不同的卡片；首列可按规范固定。",
    "states": ["loadingInitial", "ready", "empty", "refreshing", "errorInitial", "errorRefresh"],
    "themes": ["default", "dark", "compact", "reduced-motion"]
  },
  "performance": {
    "fixture": "client 1,000 行 x 20 列；virtual 100,000 逻辑行 x 20 列，60 行可视。",
    "budget": "选择和键盘移动 p95 <= 100ms；滚动不得持续产生 >50ms 长任务；子路径 gzip 增量建议 <= 35KB。"
  },
  "security": {
    "rules": ["cell renderer 不执行不受信 HTML", "组件不绕过服务端数据范围", "错误对象不得直接展示敏感响应体"]
  },
  "compatibility": {
    "legacy": "legacyId=data-grid；旧 #prototypeState 只作特征化，不是 React oracle。",
    "breakingSurfaces": ["row identity", "controlled-state semantics", "event payload", "keyboard model", "DOM roles"]
  },
  "acceptanceOracles": [
    { "id": "DG-01", "given": "3 个唯一 rowId 且 LOT-02 已选中", "when": "降序排序 rows", "then": "LOT-02 仍选中且 onSelectionChange 不因排序额外触发" },
    { "id": "DG-02", "given": "已有数据的 server 模式", "when": "刷新失败", "then": "旧数据、查询、选择和活动单元格保留并出现可键盘到达的重试" },
    { "id": "DG-03", "given": "两个重复 rowId", "when": "渲染", "then": "行级交互被阻断且出现明确契约错误，不静默合并" }
  ],
  "risk": {
    "level": "R2",
    "signals": ["data-integrity", "async-state", "large-data"],
    "rationale": "共享数据视图、选择和异步刷新错误会导致工作丢失或作用于错误记录，但本规范不直接提交关键业务写操作。",
    "triggers": ["增加编辑提交、不可逆批量操作、金额/库存/订单写入时升级 R3。"],
    "invariants": ["行身份稳定", "选择按 ID", "刷新失败不清空旧状态", "乱序响应不覆盖新查询"]
  },
  "sourceTrace": {
    "catalog": "prototype-suite/catalog.browser.json#02:data-grid",
    "preserved": ["Row[] × Column[]", "行身份稳定", "加载/空/冲突恢复"],
    "correctedFacts": ["旧主路径只有通用开始和新增行，不足以定义 DataGrid 核心语义。"]
  },
  "openDecisions": [
    { "id": "DG-D1", "question": "首版是否同时支持 client/server/virtual 三种模式，还是先拆为 DataGrid 与 VirtualDataGrid？" },
    { "id": "DG-D2", "question": "gzip 增量 35KB 是否符合私有包整体预算？" }
  ],
  "approval": {
    "status": "pending",
    "authors": ["Codex"],
    "requiredRoles": ["component-maintainer", "ux-a11y-reviewer", "test-reviewer"],
    "records": []
  }
}
